{
  "schema_version": "1.0",
  "id": "GOV-NL-002",
  "jurisdiction": "NL",
  "category": "implementation",
  "statement": "Searching 68,654 Dutch administrative decisions for aansluitplicht returned 14 hits, all about electricity or heat networks and none about water or sanitation.",
  "evidence_type": "empirical_finding",
  "source_id": "SRC-WLD-AANSLUIT",
  "locator": "METHODS_NOTE_aansluitplicht.md, abstract",
  "review_status": "unreviewed",
  "caveat": "Reported by the researcher; the raw corpus is not available to this project, so the count has not been recomputed. Interpretation (absence of litigation) is not settled."
}
