{
  "schema_version": "1.0",
  "id": "GOV-NL-001",
  "jurisdiction": "NL",
  "category": "accommodation_model",
  "statement": "Pre-litigation absorption: institutional flexibility (proportionality, protective rules, ombudsman) absorbs non-standard cases before they reach courts.",
  "evidence_type": "researcher_hypothesis",
  "source_id": "SRC-WLD-CONTEXT",
  "locator": "RESEARCH_CONTEXT.md, 'Two Models of Accommodation'",
  "review_status": "unreviewed",
  "caveat": "Researcher's theoretical model, not verified comparative evidence."
}
