{
  "schema_version": "1.0",
  "id": "GOV-CA-ON-001",
  "jurisdiction": "CA-ON",
  "category": "accommodation_model",
  "statement": "Intermediate model (stated as a hypothesis): opaque discretion and fragmented procedural protections.",
  "evidence_type": "researcher_hypothesis",
  "source_id": "SRC-WLD-CONTEXT",
  "locator": "RESEARCH_CONTEXT.md, 'Two Models of Accommodation'",
  "review_status": "unreviewed",
  "caveat": "Researcher's theoretical model, not verified comparative evidence. The source itself labels the Ontario row a hypothesis."
}
